2,Повне найменування суб'єкта господарювання,company_name,
3,Код за ЄДРПОУ,company_code,
4,Дата прийняття рішення*,decision_date,
5,назва об'єкта,to_other_body_object_name,до сфери управління іншого органу (самоврядним організаціям)
6,"балансова вартість, тис. гривень",to_other_body_assets_value,до сфери управління іншого органу (самоврядним організаціям)
7,назва об'єкта,to_municipal_property_object_name,у комунальну власність
8,"балансова вартість, тис. гривень",to_municipal_property_assets_value,у комунальну власність
9,назва об'єкта,to_other_legal_entity_object_name,між юридичними особами органу управління
10,"балансова вартість, тис. гривень",to_other_legal_entity_assets_value,між юридичними особами органу управління
